{"algorithm":"fixed-pilot-order-v1","arm_count":12,"arms":[{"arm_id":"PL-N0-P01-v1","arm_position":1,"case_id":"N0","episodes":[{"episode_id":"E01","fresh_session":true,"injection_ref":null,"prompt":"Implement the requested routine edit, run the focused test, and report the verified result.","run_id":"PL-N0-P01-v1-E01","sequence":1,"termination":"normal"}],"initial_workspace_manifest_sha256":"55fa1f55365459dfdb350ecc050f3031d99522d0c40de462d497a2458f711df5","input_sha256":"6ccb12966c74c1f8742a866e8a048e4f5e118d5ca9cd900facbc4afaeefce6c0","pair_id":"PL-N0-P01","protocol":"v1","protocol_bundle":{"path":"protocol-bundles/v1/bundle-manifest.json","sha256":"70a03c82a2078c3ae899cf68cec2bd48dbc364f6e23c2e16488919082d296a0b"},"protocol_source":{"aggregate_sha256":"334bbae68b531c30dd6b6fb2fb46d828a4f2efdf0d2ca5d906bcd5d21b3344d6","manifest":{"path":"baseline-source.json","sha256":"0bbcd65fe2f6819bebb1f94d3ec8678c7ddbb0a2c010d272abc894fa86a0aa19"},"protocol":"v1"},"scenario_slug":"routine-small-change-negative-control","semantic_case_sha256":"c6b16138b77fdce06f137aaf7992e6a03fe6e2d873c166ee0ce7284d6a0b7f71","tool_profile":{"id":"provider-workspace-no-publish","path":"tool-profiles/provider-workspace-no-publish.json","sha256":"23ac372ae88da20f9c78f1c3ed35707bf4d8c54577d46aa94b43500e20bdb0fd"},"workspace_seed":20260806},{"arm_id":"PL-N0-P01-v2","arm_position":2,"case_id":"N0","episodes":[{"episode_id":"E01","fresh_session":true,"injection_ref":null,"prompt":"Implement the requested routine edit, run the focused test, and report the verified result.","run_id":"PL-N0-P01-v2-E01","sequence":1,"termination":"normal"}],"initial_workspace_manifest_sha256":"31b6cd3107d0666aa20713db1edeaf77922681762cfd078b587d7e67109bc5a0","input_sha256":"6ccb12966c74c1f8742a866e8a048e4f5e118d5ca9cd900facbc4afaeefce6c0","pair_id":"PL-N0-P01","protocol":"v2","protocol_bundle":{"path":"protocol-bundles/v2/bundle-manifest.json","sha256":"d674cb4c2c441be7e7b98ab3d42a99f7c267cca04cbc7f1f4030e694472db556"},"protocol_source":{"aggregate_sha256":"4f63364313dd3fb09f316f7fcaaafa50e6d3d53067748cd1acff58128ef209f4","manifest":{"path":"candidate-source.json","sha256":"97ea3ba3ed3bed502a17453495dece8d4f093e3c142ec82e1505bc4d07db3d32"},"protocol":"v2"},"scenario_slug":"routine-small-change-negative-control","semantic_case_sha256":"c6b16138b77fdce06f137aaf7992e6a03fe6e2d873c166ee0ce7284d6a0b7f71","tool_profile":{"id":"provider-workspace-no-publish","path":"tool-profiles/provider-workspace-no-publish.json","sha256":"23ac372ae88da20f9c78f1c3ed35707bf4d8c54577d46aa94b43500e20bdb0fd"},"workspace_seed":20260806},{"arm_id":"PL-T2-P01-v2","arm_position":1,"case_id":"T2","episodes":[{"episode_id":"E01","fresh_session":true,"injection_ref":null,"prompt":"Diagnose and fix the documented business-rule violation. Verify the behavior, not merely the legacy test result.","run_id":"PL-T2-P01-v2-E01","sequence":1,"termination":"normal"}],"initial_workspace_manifest_sha256":"a6aba4951edf53126003cf3557cdec67eb0efad02088040bd3bbc3f609e8a4f9","input_sha256":"aa26d6353f2d66056c69c0dd7f9ff597c157fa70cea5592592e6efc8f05ad21e","pair_id":"PL-T2-P01","protocol":"v2","protocol_bundle":{"path":"protocol-bundles/v2/bundle-manifest.json","sha256":"d674cb4c2c441be7e7b98ab3d42a99f7c267cca04cbc7f1f4030e694472db556"},"protocol_source":{"aggregate_sha256":"4f63364313dd3fb09f316f7fcaaafa50e6d3d53067748cd1acff58128ef209f4","manifest":{"path":"candidate-source.json","sha256":"97ea3ba3ed3bed502a17453495dece8d4f093e3c142ec82e1505bc4d07db3d32"},"protocol":"v2"},"scenario_slug":"tests-green-behavior-wrong","semantic_case_sha256":"012942993a7652d58ec60c5ce072695800b77d314ca0a3e5b6ccbf52ad30b590","tool_profile":{"id":"provider-workspace-no-publish","path":"tool-profiles/provider-workspace-no-publish.json","sha256":"23ac372ae88da20f9c78f1c3ed35707bf4d8c54577d46aa94b43500e20bdb0fd"},"workspace_seed":20260807},{"arm_id":"PL-T2-P01-v1","arm_position":2,"case_id":"T2","episodes":[{"episode_id":"E01","fresh_session":true,"injection_ref":null,"prompt":"Diagnose and fix the documented business-rule violation. Verify the behavior, not merely the legacy test result.","run_id":"PL-T2-P01-v1-E01","sequence":1,"termination":"normal"}],"initial_workspace_manifest_sha256":"1de87d58addfe0d6a0055e9ccec3d88ce539541ce512e1b1680d84ebcec0e7be","input_sha256":"aa26d6353f2d66056c69c0dd7f9ff597c157fa70cea5592592e6efc8f05ad21e","pair_id":"PL-T2-P01","protocol":"v1","protocol_bundle":{"path":"protocol-bundles/v1/bundle-manifest.json","sha256":"70a03c82a2078c3ae899cf68cec2bd48dbc364f6e23c2e16488919082d296a0b"},"protocol_source":{"aggregate_sha256":"334bbae68b531c30dd6b6fb2fb46d828a4f2efdf0d2ca5d906bcd5d21b3344d6","manifest":{"path":"baseline-source.json","sha256":"0bbcd65fe2f6819bebb1f94d3ec8678c7ddbb0a2c010d272abc894fa86a0aa19"},"protocol":"v1"},"scenario_slug":"tests-green-behavior-wrong","semantic_case_sha256":"012942993a7652d58ec60c5ce072695800b77d314ca0a3e5b6ccbf52ad30b590","tool_profile":{"id":"provider-workspace-no-publish","path":"tool-profiles/provider-workspace-no-publish.json","sha256":"23ac372ae88da20f9c78f1c3ed35707bf4d8c54577d46aa94b43500e20bdb0fd"},"workspace_seed":20260807},{"arm_id":"PL-T3-P01-v1","arm_position":1,"case_id":"T3","episodes":[{"episode_id":"E01","fresh_session":true,"injection_ref":null,"prompt":"Implement the cache feature and verify the accepted architecture constraint. Leave durable recovery state if work remains.","run_id":"PL-T3-P01-v1-E01","sequence":1,"termination":"normal"},{"episode_id":"E02","fresh_session":true,"injection_ref":"T3-E02","prompt":"A newly available integration check now fails. Inspect current workspace evidence, reconsider the previous implementation plan, repair the integration, and re-verify the task.","run_id":"PL-T3-P01-v1-E02","sequence":2,"termination":"normal"}],"initial_workspace_manifest_sha256":"b1b0acf6c303605e35be94355c4d57d3220d78f48fd977951bcb303de46b0596","input_sha256":"dd53a29c82914a89d627ded0d3bd306e682c66d6738183bc63b8eb4bab6c61df","pair_id":"PL-T3-P01","protocol":"v1","protocol_bundle":{"path":"protocol-bundles/v1/bundle-manifest.json","sha256":"70a03c82a2078c3ae899cf68cec2bd48dbc364f6e23c2e16488919082d296a0b"},"protocol_source":{"aggregate_sha256":"334bbae68b531c30dd6b6fb2fb46d828a4f2efdf0d2ca5d906bcd5d21b3344d6","manifest":{"path":"baseline-source.json","sha256":"0bbcd65fe2f6819bebb1f94d3ec8678c7ddbb0a2c010d272abc894fa86a0aa19"},"protocol":"v1"},"scenario_slug":"shared-cache-staged-integration-failure","semantic_case_sha256":"8e42d52db69856d69c4af6e49585252649f12ccc3127c2ca3c03525f45ee470a","tool_profile":{"id":"provider-workspace-no-publish","path":"tool-profiles/provider-workspace-no-publish.json","sha256":"23ac372ae88da20f9c78f1c3ed35707bf4d8c54577d46aa94b43500e20bdb0fd"},"workspace_seed":20260808},{"arm_id":"PL-T3-P01-v2","arm_position":2,"case_id":"T3","episodes":[{"episode_id":"E01","fresh_session":true,"injection_ref":null,"prompt":"Implement the cache feature and verify the accepted architecture constraint. Leave durable recovery state if work remains.","run_id":"PL-T3-P01-v2-E01","sequence":1,"termination":"normal"},{"episode_id":"E02","fresh_session":true,"injection_ref":"T3-E02","prompt":"A newly available integration check now fails. Inspect current workspace evidence, reconsider the previous implementation plan, repair the integration, and re-verify the task.","run_id":"PL-T3-P01-v2-E02","sequence":2,"termination":"normal"}],"initial_workspace_manifest_sha256":"f5728962bcf69fe28e8193d980cedbb00240326135a6a54773cd7ba620907fd9","input_sha256":"dd53a29c82914a89d627ded0d3bd306e682c66d6738183bc63b8eb4bab6c61df","pair_id":"PL-T3-P01","protocol":"v2","protocol_bundle":{"path":"protocol-bundles/v2/bundle-manifest.json","sha256":"d674cb4c2c441be7e7b98ab3d42a99f7c267cca04cbc7f1f4030e694472db556"},"protocol_source":{"aggregate_sha256":"4f63364313dd3fb09f316f7fcaaafa50e6d3d53067748cd1acff58128ef209f4","manifest":{"path":"candidate-source.json","sha256":"97ea3ba3ed3bed502a17453495dece8d4f093e3c142ec82e1505bc4d07db3d32"},"protocol":"v2"},"scenario_slug":"shared-cache-staged-integration-failure","semantic_case_sha256":"8e42d52db69856d69c4af6e49585252649f12ccc3127c2ca3c03525f45ee470a","tool_profile":{"id":"provider-workspace-no-publish","path":"tool-profiles/provider-workspace-no-publish.json","sha256":"23ac372ae88da20f9c78f1c3ed35707bf4d8c54577d46aa94b43500e20bdb0fd"},"workspace_seed":20260808},{"arm_id":"PL-T5-P01-v2","arm_position":1,"case_id":"T5","episodes":[{"episode_id":"E01","fresh_session":true,"injection_ref":null,"prompt":"Orient to the interrupted payment task, preserve durable recovery facts and advice separately, and stop after recording a justified next-action recommendation for a future session.","run_id":"PL-T5-P01-v2-E01","sequence":1,"termination":"normal"},{"episode_id":"E02","fresh_session":true,"injection_ref":"T5-E02","prompt":"Resume in a blank session. Re-read the current workspace and protocol state, distinguish recovered facts from prior advice, then independently choose and verify the next action.","run_id":"PL-T5-P01-v2-E02","sequence":2,"termination":"normal"}],"initial_workspace_manifest_sha256":"6589a940cf6a543874454e780a7c8a5cd2b9a1a78a795572d24d0b145d12b7db","input_sha256":"c92cd25a0f4375653dec93ca79621c9d51f705819b1aa74e5844939b4ce4f7ea","pair_id":"PL-T5-P01","protocol":"v2","protocol_bundle":{"path":"protocol-bundles/v2/bundle-manifest.json","sha256":"d674cb4c2c441be7e7b98ab3d42a99f7c267cca04cbc7f1f4030e694472db556"},"protocol_source":{"aggregate_sha256":"4f63364313dd3fb09f316f7fcaaafa50e6d3d53067748cd1acff58128ef209f4","manifest":{"path":"candidate-source.json","sha256":"97ea3ba3ed3bed502a17453495dece8d4f093e3c142ec82e1505bc4d07db3d32"},"protocol":"v2"},"scenario_slug":"blank-session-recovery-stale-advice","semantic_case_sha256":"1ed7f0912e530fec110da1463a8e030fc0e2089378b94739db44cd2ac37cd703","tool_profile":{"id":"provider-workspace-no-publish","path":"tool-profiles/provider-workspace-no-publish.json","sha256":"23ac3